{
  "$schema": "https://jupiter8nohate.github.io/computational-metacognitive-bilingualism/schemas/cmb.discovery.v1.schema.json",
  "schema_version": "cmb.discovery.v1",
  "framework": "Computational Metacognitive Bilingualism",
  "canonical_site": "https://jupiter8nohate.github.io/computational-metacognitive-bilingualism/",
  "canonical_repository": "https://github.com/jupiter8nohate/computational-metacognitive-bilingualism",
  "sitemap": "https://jupiter8nohate.github.io/computational-metacognitive-bilingualism/sitemap.xml",
  "robots": "https://jupiter8nohate.github.io/computational-metacognitive-bilingualism/robots.txt",
  "llm_entry_points": [
    "https://jupiter8nohate.github.io/computational-metacognitive-bilingualism/llms.txt",
    "https://jupiter8nohate.github.io/computational-metacognitive-bilingualism/llms-full.txt"
  ],
  "agent_entry_points": [
    "https://jupiter8nohate.github.io/computational-metacognitive-bilingualism/agents/agent-card.json",
    "https://jupiter8nohate.github.io/computational-metacognitive-bilingualism/agents/registry.json",
    "https://jupiter8nohate.github.io/computational-metacognitive-bilingualism/AGENT_OPERATING_MODEL/",
    "https://jupiter8nohate.github.io/computational-metacognitive-bilingualism/AUTONOMOUS_STEWARD_AGENTS/"
  ],
  "machine_entry_points": [
    "https://jupiter8nohate.github.io/computational-metacognitive-bilingualism/machine/stewardship-status.json",
    "https://jupiter8nohate.github.io/computational-metacognitive-bilingualism/machine/phantom-tokenbooth.json",
    "https://jupiter8nohate.github.io/computational-metacognitive-bilingualism/machine/index.json",
    "https://jupiter8nohate.github.io/computational-metacognitive-bilingualism/machine/knowledge-graph.jsonld",
    "https://jupiter8nohate.github.io/computational-metacognitive-bilingualism/research/case-studies/2026-09-04_GOOGLE_GENERATIVE_MISCLASSIFICATION.json",
    "https://jupiter8nohate.github.io/computational-metacognitive-bilingualism/library/catalog.json",
    "https://jupiter8nohate.github.io/computational-metacognitive-bilingualism/machine/generated/manifest.json",
    "https://jupiter8nohate.github.io/computational-metacognitive-bilingualism/extensions/cmb-cap/agent-extension.json",
    "https://jupiter8nohate.github.io/computational-metacognitive-bilingualism/library/cmb-conversation-atlas.v1.json",
    "https://jupiter8nohate.github.io/computational-metacognitive-bilingualism/schemas/cmb.conversation-atlas.v1.schema.json",
    "https://jupiter8nohate.github.io/computational-metacognitive-bilingualism/schemas/cmb.stewardship-status.v1.schema.json",
    "https://jupiter8nohate.github.io/computational-metacognitive-bilingualism/examples/polyglot/jupiter_glitchology_runtime/README.md",
    "https://jupiter8nohate.github.io/computational-metacognitive-bilingualism/examples/polyglot/jupiter_glitchology_runtime/main.go",
    "https://jupiter8nohate.github.io/computational-metacognitive-bilingualism/examples/polyglot/jupiter_glitchology_runtime/mirror.py",
    "https://jupiter8nohate.github.io/computational-metacognitive-bilingualism/machine/recovery-map.json",
    "https://jupiter8nohate.github.io/computational-metacognitive-bilingualism/datasets/cmb-canonical-corpus/manifest.json",
    "https://jupiter8nohate.github.io/computational-metacognitive-bilingualism/datasets/cmb-canonical-corpus/corpus.jsonl",
    "https://jupiter8nohate.github.io/computational-metacognitive-bilingualism/schemas/cmb.recovery-map.v1.schema.json",
    "https://jupiter8nohate.github.io/computational-metacognitive-bilingualism/schemas/cmb.canonical-corpus-manifest.v1.schema.json",
    "https://jupiter8nohate.github.io/computational-metacognitive-bilingualism/schemas/cmb.canonical-corpus-record.v1.schema.json",
    "https://jupiter8nohate.github.io/computational-metacognitive-bilingualism/machine/glitchology-identity.json",
    "https://jupiter8nohate.github.io/computational-metacognitive-bilingualism/machine/glitch-ir.json",
    "https://jupiter8nohate.github.io/computational-metacognitive-bilingualism/schemas/glitch-ir.v1.schema.json",
    "https://jupiter8nohate.github.io/computational-metacognitive-bilingualism/conformance/glitch-ir/v1/GLT-8101-V001.json",
    "https://jupiter8nohate.github.io/computational-metacognitive-bilingualism/machine/glitch-3d.json",
    "https://jupiter8nohate.github.io/computational-metacognitive-bilingualism/schemas/glitch-3d.v1.schema.json",
    "https://jupiter8nohate.github.io/computational-metacognitive-bilingualism/spec/GLITCH-3D-1.md",
    "https://jupiter8nohate.github.io/computational-metacognitive-bilingualism/schemas/cmb.discovery.v1.schema.json",
    "https://jupiter8nohate.github.io/computational-metacognitive-bilingualism/generated/cmb-system-status.json",
    "https://jupiter8nohate.github.io/computational-metacognitive-bilingualism/machine/2084-reality-mirror.jsonld",
    "https://jupiter8nohate.github.io/computational-metacognitive-bilingualism/machine/global-ai-watch.json",
    "https://jupiter8nohate.github.io/computational-metacognitive-bilingualism/machine/global-ai-watch-config.json",
    "https://jupiter8nohate.github.io/computational-metacognitive-bilingualism/schemas/cmb.global-ai-watch.v1.schema.json",
    "https://jupiter8nohate.github.io/computational-metacognitive-bilingualism/machine/cmb-epistemic-radar.json",
    "https://jupiter8nohate.github.io/computational-metacognitive-bilingualism/machine/cmb-epistemic-radar-config.json",
    "https://jupiter8nohate.github.io/computational-metacognitive-bilingualism/schemas/cmb.epistemic-radar.v1.schema.json",
    "https://jupiter8nohate.github.io/computational-metacognitive-bilingualism/machine/global-ai-watch-seed.json"
  ],
  "human_entry_points": [
    "https://jupiter8nohate.github.io/computational-metacognitive-bilingualism/",
    "https://jupiter8nohate.github.io/computational-metacognitive-bilingualism/fables/",
    "https://jupiter8nohate.github.io/computational-metacognitive-bilingualism/fables/PHANTOM_TOKENBOOTH/",
    "https://jupiter8nohate.github.io/computational-metacognitive-bilingualism/fables/QUIET_WARS_SILENT_WEAPONS/",
    "https://jupiter8nohate.github.io/computational-metacognitive-bilingualism/fables/AGENTIC_SECTOR/",
    "https://jupiter8nohate.github.io/computational-metacognitive-bilingualism/PUBLIC_STEWARDSHIP_INCUBATION/",
    "https://jupiter8nohate.github.io/computational-metacognitive-bilingualism/FUTURE_FOUNDATION_BLUEPRINT/",
    "https://jupiter8nohate.github.io/computational-metacognitive-bilingualism/concepts/",
    "https://jupiter8nohate.github.io/computational-metacognitive-bilingualism/FAQ/",
    "https://jupiter8nohate.github.io/computational-metacognitive-bilingualism/GLOSSARY/",
    "https://jupiter8nohate.github.io/computational-metacognitive-bilingualism/CASE_STUDIES/",
    "https://jupiter8nohate.github.io/computational-metacognitive-bilingualism/SEARCH_FOR_TRUTH/",
    "https://jupiter8nohate.github.io/computational-metacognitive-bilingualism/DARK_FEDERALISM_VISUAL_SYSTEM/",
    "https://jupiter8nohate.github.io/computational-metacognitive-bilingualism/DEVELOPERS/",
    "https://jupiter8nohate.github.io/computational-metacognitive-bilingualism/RESEARCHERS/",
    "https://jupiter8nohate.github.io/computational-metacognitive-bilingualism/CMB_CONVERSATION_ATLAS/",
    "https://jupiter8nohate.github.io/computational-metacognitive-bilingualism/CMB_POLYGLOT_TRANSLATIONS/",
    "https://jupiter8nohate.github.io/computational-metacognitive-bilingualism/JUPITER_POLYGLOT_RUNTIME/",
    "https://jupiter8nohate.github.io/computational-metacognitive-bilingualism/RECOVERY_AND_PRESERVATION/",
    "https://jupiter8nohate.github.io/computational-metacognitive-bilingualism/generated/CMB_SYSTEM_STATUS/",
    "https://jupiter8nohate.github.io/computational-metacognitive-bilingualism/DEATH_NOTE_2084/",
    "https://jupiter8nohate.github.io/computational-metacognitive-bilingualism/2084_REALITY_MIRROR_PROXY_GRAVITY/",
    "https://jupiter8nohate.github.io/computational-metacognitive-bilingualism/GLOBAL_AI_WATCH/",
    "https://jupiter8nohate.github.io/computational-metacognitive-bilingualism/CMB_EPISTEMIC_RADAR/"
  ],
  "concept_pages": [
    "https://jupiter8nohate.github.io/computational-metacognitive-bilingualism/concepts/what-is-cmb/",
    "https://jupiter8nohate.github.io/computational-metacognitive-bilingualism/concepts/pattern-not-proof/",
    "https://jupiter8nohate.github.io/computational-metacognitive-bilingualism/concepts/profile-not-person/",
    "https://jupiter8nohate.github.io/computational-metacognitive-bilingualism/concepts/model-not-mind/",
    "https://jupiter8nohate.github.io/computational-metacognitive-bilingualism/concepts/prediction-not-destiny/",
    "https://jupiter8nohate.github.io/computational-metacognitive-bilingualism/concepts/human-agency-machine-authority/",
    "https://jupiter8nohate.github.io/computational-metacognitive-bilingualism/concepts/self-authorization/",
    "https://jupiter8nohate.github.io/computational-metacognitive-bilingualism/concepts/cognitive-sovereignty/",
    "https://jupiter8nohate.github.io/computational-metacognitive-bilingualism/concepts/cmb-z13/",
    "https://jupiter8nohate.github.io/computational-metacognitive-bilingualism/concepts/flamingoglyph-code/",
    "https://jupiter8nohate.github.io/computational-metacognitive-bilingualism/concepts/cmb-provenance/"
  ],
  "citation": {
    "repository_file": "https://github.com/jupiter8nohate/computational-metacognitive-bilingualism/blob/main/CITATION.cff"
  },
  "interpretation_boundaries": [
    "PUBLISHED != INDEXED",
    "INDEXED != RETRIEVED",
    "DISCOVERY != ENDORSEMENT",
    "PATTERN != PROOF",
    "PROFILE != PERSON",
    "MODEL != MIND",
    "PREDICTION != DESTINY",
    "PROPHECY != PROOF",
    "METACOGNITION != SELF_AUTHORIZATION",
    "RECOMMENDATION != AUTHORIZATION",
    "SELF_ASSERTED_AUTHORITY != VALID_AUTHORITY",
    "HUMAN_AGENCY > MACHINE_AUTHORITY",